{"contract_id":"k-demo","version":1,"intent":{"claim":"publish required content","requester_id":"r-demo","created_at":"2026-08-09T00:00:00Z","constraints":[]},"proof_obligations":[{"obligation_id":"content","required":true,"evidence_type":"image","predicate":"contains required statement","failure_mode":"reject"}],"binding":{"task_id":"t-demo","policy_version":1,"required_context":[],"hash_algorithm":"sha256"},"verifier":{"decision_space":["accept","reject","abstain"],"hard_conflicts":[],"degradation_policy":{},"threshold_version":"theta-1"},"admissible_transitions":["mark_complete"],"receipt_schema_version":1,"evidence_governance":{"max_artifacts":2,"max_retained_bytes":1000000,"prohibited_fields":["biometric_template"]},"appeal_policy":{"allowed":true,"stays_transition":false,"response_window_hours":72}}
